{
  "assignedBy": "3fa85f64-5717-4562-b3fc-2c963f66afa6",
  "assignedTo": "3fa85f64-5717-4562-b3fc-2c963f66afa6",
  "section": "A",
  "campus": "Delhi",
  "session": "2022-2023",
  "course": "V",
  "subject": "Math",
  "workType": "CW",
  "homeWorkDate": "2023-08-25T06:07:25.83Z",
  "homeDueDate": "2023-08-25T06:07:25.83Z",
  "notes": "Hi This is new home ",
  "fileName": "Please give file name",
  "fileContent": "Provide base64 encoded file content"
}